Nama Pengguna,Teks Ulasan,Rating Bintang,Tanggal Ulasan,Jumlah Likes
Pengguna Google,"game nya dah bagus, story, Battle sama karakter nya dah mantep banget tapi kalo bisa tambahin fitur ganti gender mc kek wuthering wawes sih, soalnya kan MC hsr ini satu orang yang sama tapi cuman beda gender doang mudahan aja fitur ganti gender mc ini beneran ini bikin sih...",5,2025-04-13 08:42:02,0
Pengguna Google,"MANTAP CASTORICE GW OP BAT ANJAYðŸ˜†, YANG KAGAK DAPET SABAR YA MASBROOðŸ¥²",5,2025-04-13 08:37:52,1
Pengguna Google,"overall keseluruhan game nya bagus menarik apalagi story nya beh seru banget, cuma ada sebagian masalah di story yang malah ngebingungin playernya, trus juga di update baru pas pake char casto device suka lagÂ² padahal pake char lain ga ada lag atau delay sama sekali, kalo semisal itu bug semoga segera di fix ya",5,2025-04-13 08:24:54,3
Pengguna Google,"makasih sudah membuat karakter se-OP Castorice, banyakin bansos kedepannya",5,2025-04-13 08:15:24,0
Pengguna Google,tolong tambahkan fitur skip story,5,2025-04-13 08:02:57,0
Pengguna Google,karena ini seru,5,2025-04-13 07:38:20,0
Pengguna Google,Anti kikirðŸ—¿ðŸ‘,5,2025-04-13 07:08:27,0
Pengguna Google,halo dev saya belum tidur demi gacha Castorice beri saya castorice gapapa high pity yang penting dapet,5,2025-04-13 07:01:26,1
Pengguna Google,GAME BAGUS,5,2025-04-13 06:32:31,0
Pengguna Google,meskipun buzzer,5,2025-04-13 06:20:49,0
Pengguna Google,makasih game baikðŸ¥°ðŸ¥°,5,2025-04-13 06:20:47,0
Pengguna Google,ðŸ‘,5,2025-04-13 06:20:08,0
Pengguna Google,akhirnya si bro naik rate-nya jadi 4.0,5,2025-04-13 06:19:05,0
Pengguna Google,menurut gw DAn opini gw ini game misi nya agak susah dan sulit di mengerti sih.,3,2025-04-13 06:02:35,0
Pengguna Google,i love this game sm,5,2025-04-13 06:01:25,0
Pengguna Google,"Frame drop pas awal masuk di animasi kereta+ tambahin fitur skip dialog, akun lama hilang setelah tidak main Â± 4 bln dan ngulang dari 0 lagi akun GI juga ilang",1,2025-04-13 05:44:42,3
Pengguna Google,beri LC casto dalam 10Ã—gacha baru dinaikkin ðŸ˜,1,2025-04-13 05:43:23,0
Pengguna Google,ni b5(sekarang kasih aku menang rate of pity low sabayak 10),5,2025-04-13 05:36:54,0
Pengguna Google,game cihuyyy,5,2025-04-13 05:13:13,0
Pengguna Google,game nya bagus,5,2025-04-13 05:06:43,0
Pengguna Google,sumpah ni game bikin gw nangis terutama di cerita firefly sama castoris ya walau powercreepnya ga ngotak tapi kalo ceritanya bagus tetap enjoy main ya makasih hoyo telat buat game hsr ini dengan cerita yang bagusðŸ˜,5,2025-04-13 04:53:07,2
Pengguna Google,kok pda rating *1 ada masalah kh sama game nya?,5,2025-04-13 04:52:55,0
Pengguna Google,Semoga hoki,5,2025-04-13 04:33:32,12
Pengguna Google,Don't know don't care,5,2025-04-13 04:31:22,0
Pengguna Google,lebih bagus dari pada genshin!!!,1,2025-04-13 04:15:13,1
Pengguna Google,"saat cut scene seperti movie sangat hd dan bagus, story nya juga bagus bagus semua",5,2025-04-13 04:00:31,1
Pengguna Google,sangat suka apalagi kalo menang rate of:),5,2025-04-13 03:56:22,0
Pengguna Google,game ini bagus gw dikasi win 50/50 6 kali,5,2025-04-13 03:48:26,0
Pengguna Google,Karena dapet Castorice pity 14 saya kasih B5,5,2025-04-13 03:43:12,0
Pengguna Google,semangat hsr meski banyak yang ngehujat. tapi kenapa ya orang2 pada gak terima sama castorice gitu padahal mah biasa aja gak sih nama nya juga game p2w,5,2025-04-13 03:42:18,0
Pengguna Google,bukan game turn base,1,2025-04-13 03:38:32,0
Pengguna Google,plis hoyo berikan aku castorice buat bantai2 konten demi caelusðŸ¥ºðŸ¥ºðŸ¥º jangan berikan aku seele,5,2025-04-13 03:38:22,24
Pengguna Google,Gamenya bagus seru mantap oke oke story ga bosenin tiap update pasti semangat buat langsung ngerjain storynya karna emang seru bansos banyak banget cik oke oke,5,2025-04-13 03:36:23,0
Pengguna Google,Game baik story ny bagus. versi terbaru peak cinema. ðŸ‘ðŸ‘ðŸ‘ðŸ‘,5,2025-04-13 02:44:07,0
Pengguna Google,terus berkembang ya gem nya,5,2025-04-13 02:10:08,0
Pengguna Google,"Game ini menurut saya bagus,apalagi soal story yg bikin nyaman,saya harap ada pengembangan trus,pokoknya the best lah game ini",5,2025-04-13 02:02:32,0
Pengguna Google,"enjoy tapi, banyak rate off yang tidak tertolong",5,2025-04-13 01:07:32,0
Pengguna Google,"untuk segi effect, bansos dll ok yang masih kurang itu questnya luama buanget damn bro, semoga di adain fitur skip lah ya, sama adain fitur ganti mc walaupun sekali. trima kasih.",4,2025-04-13 00:57:02,0
Pengguna Google,penyakit powercreep gilaðŸ˜¹,1,2025-04-13 00:49:30,1
Pengguna Google,dri segi permainan dan story nya game ini sangat memiliki story yg sgt bagus dan tidak bosen,5,2025-04-13 00:44:25,1
Pengguna Google,"tdk bisa main gamenya gara2 blackscreen trs tiap tengah story. dahal dulu tdk ada keluhan. udh gitu coba ganti device ke handphone, malah blackscreen di loading screen. tolong diperbaiki. edit: setelah update game, di laptop sempet berfungsi, tapi masih sering stuck di blackscreen. tolong diperbaiki.",1,2025-04-13 00:37:09,14
Pengguna Google,sampah,1,2025-04-13 00:16:27,0
Pengguna Google,"kami sayang hoyo,hoyo sayang kamiðŸ¥°",5,2025-04-13 00:10:18,0
Pengguna Google,game nya eror masak ada tulisan unity erorðŸ˜­ udah gitu di tendang terus dari game padahal kemarin lancar tibaÂ² gabisa dimainin game nya ðŸ˜­please lah di perbaiki bug nya ðŸ˜­ HP ku wuwa rata kanan kuat loh ðŸ˜­masak hsr gabisa ðŸ‘Š,1,2025-04-12 23:54:40,1
Pengguna Google,"gamee nyaa baikk, sukaa ngasihh bansoss jadii akuu sukaa samaa gamee nya ðŸ˜Šâœ¨",5,2025-04-12 23:49:12,1
Pengguna Google,"pergantian meta yang konstan sungguh menghalangi pengalaman bermain saya. setiap versi, rasanya saya harus terus gacha karakter terbaru agar bisa keep up dengan game saat ini. belum lagi jumlah karakter bintang 4 yang sangat sedikit dan ditambah semua hal yang dibutuhkan karakter sangat ketergantungan dengan farming. setiap versi, selalu dirilis dua karakter bintang 5 baru.event pun sekarang lebih sedikit dan tak semenyenangkan dulu. dari game baik sekarang malah jadi game kikir. tolong taubat.",1,2025-04-12 23:13:13,0
Pengguna Google,"stop the hp inflation, i swear",1,2025-04-12 22:12:52,2
Pengguna Google,"kenapa aku stuck di mengunduh data ya? aku setelah mengunduh data terus masuk buat ngunduh data seluruhnya, terus aku pencet sambil aku tunggu semalaman tapi pas aku cek mlh kembali ke tampilan mengunduh data awal. tolong dong ini gimana",1,2025-04-12 20:56:25,1
Pengguna Google,banyak Waifu,5,2025-04-12 19:51:54,0
Pengguna Google,"Hello ðŸ‘‹ Developer. I Have Input While in Battle : Add Features â€¢ Remove Text Damage but total damage remains. Because with the disappearance of the DMG text in battle, things can go smoothly. â€¢ Save Device Battery Power In Battle Auto And Manual. Device Battery Usage Wasteful Thank you for reading and listening. From your players.",5,2025-04-12 19:30:38,0
Pengguna Google,the rate of is ridiculous,1,2025-04-12 18:37:26,0
Pengguna Google,game bagus saya pernah memainkannya dulu gameplay-nya sangat menarik,5,2025-04-12 18:16:07,0
Pengguna Google,stuck loading screen udah coba berbagi cara masih aja stuck kecepatan jaringan aja lebih dari cukup padahal,1,2025-04-12 18:07:39,2
Pengguna Google,fomo aja,1,2025-04-12 18:06:38,0
Pengguna Google,Game Pembodohan,1,2025-04-12 18:00:17,0
Pengguna Google,"Akun mkalah rate off Mulu apalahhh pas rate on malah mentok 80 pdhl gw pemain awal lohhhh pemain preregister kawan kawan gw walauentok dikasi dobel kok rasanya gw sial sendiri dahh, gw g ikut ikutan spam bintang 1 juga kmrn, ni game kok jahat kali Ama akun ku",1,2025-04-12 17:55:40,0
Pengguna Google,love it,5,2025-04-12 17:18:09,0
Pengguna Google,seru ini game padahal bisa sambil nyantai,5,2025-04-12 17:14:43,0
Pengguna Google,"game bagus, bansos nya juga bnyk ðŸ‘ðŸ‘ðŸ‘",5,2025-04-12 17:14:10,0
Pengguna Google,lawak,1,2025-04-12 17:09:25,0
Pengguna Google,tolong diberi akses support controller ds4 min,5,2025-04-12 16:51:02,0
Pengguna Google,gamenya bagus,5,2025-04-12 16:44:14,0
Pengguna Google,jangan di hapus plis,5,2025-04-12 16:43:30,0
Pengguna Google,HENTIKAN HP INFLATION!!!,1,2025-04-12 16:18:57,0
Pengguna Google,"menang 50 50 banner mydei & global queen + LC, thank you game baik ðŸ˜†ðŸ˜†ðŸ˜†",5,2025-04-12 16:07:41,0
Pengguna Google,Pls give me ayg (Firefly),4,2025-04-12 16:07:06,0
Pengguna Google,Mantap hoyo jgan kikir ga kyk kakaknya,5,2025-04-12 16:05:28,0
Pengguna Google,kecewa,1,2025-04-12 15:58:28,0
Pengguna Google,game baik,5,2025-04-12 15:50:38,0
Pengguna Google,it's has a good story,5,2025-04-12 15:42:28,0
Pengguna Google,"Game bagus, story mantap, karakterÂ² nya jg oke oke, karakternya jg ekspresif jdi terasa lebih hidupðŸ‘",5,2025-04-12 15:37:52,0
Pengguna Google,game ini sangat baik mulai dari bansos yang banyak pembawaan story yang menarik character yang bagus dan gacha yang hoki,5,2025-04-12 15:28:38,1
Pengguna Google,baguss,5,2025-04-12 15:24:15,0
Pengguna Google,best lah,5,2025-04-12 15:18:02,0
Pengguna Google,fomo,5,2025-04-12 15:16:47,0
Pengguna Google,Variabel baru story: text hitam layar putih. Plis kasih drip marketing baru 4* karakter,4,2025-04-12 15:10:33,36
Pengguna Google,pasti KLO update login emang error ya ? ini developer pliss lahh,3,2025-04-12 15:08:07,2
Pengguna Google,tambahin fitur cancel ulti( Í¡ ÍœÊ– Í¡ ),5,2025-04-12 15:07:59,3
Pengguna Google,Good,5,2025-04-12 15:01:10,0
Pengguna Google,"Love this game! grafik nya okeee banget, karakternya cakeup cakeup! Storynya jg keren&menarik. walau ada keluhan dariku tentang powercreep. but overall this is a recommend game!",4,2025-04-12 14:53:32,0
Pengguna Google,gooood!,5,2025-04-12 14:41:36,0
Pengguna Google,yang ngerosting ni gem gara gara casto lu tlol,1,2025-04-12 14:34:01,0
Pengguna Google,gamenya udah bagus tapi kali bisa itu stori kasih pitur skip lah ngantuk ashu,2,2025-04-12 14:29:15,0
Pengguna Google,"wah makin2 ni game sm fandomnya, aplgi waifu fans. mana dev nya ngedukung invest char cwe dibandimg char cowo. Ga adil bet, cb sebutin game rpg mana yg adil ke player cewe? GA ENJOY NYELESAIN END GAME NYA, bnyk char yg kena powercrept and ada nya favoritism ke 1 char yg ky ny ni dev maksa kt buat pull. Hadeh, char cowo aja minim bgt animasi2 in gamenya, pdhl char cwe dr dlu always di improve ini itu, char cwo apa njr? meski kit gg tp ttp aj kettupan waifu. Anaxa jg rilis dianiv y hoyo. Not fair",1,2025-04-12 14:14:20,2
Pengguna Google,peakkk story and charðŸ¤©ðŸ¤©,5,2025-04-12 14:06:09,0
Pengguna Google,"netral aja lah di bilang bagus yah bagus di bilang jelek yah jelek ,bingung anjir disisi lain karter setoriy lumayan segi mita mesti powercrip Mulu Anjir kayak p2w",3,2025-04-12 14:06:03,0
Pengguna Google,"saya player dari 1.6, saya bingung kenapa pada marah karena global pasif? karena pada dasarnya itu kembali ke kita untuk apakah mau gacha karakternya atau egak, kalo main dibawa santai aja jangan terlalu focus, saya pengguna mono Quatum sejak 1.6 jadi gak pernah gepull karakter yang op kayak archeron,topaz,aventurin, dll. satu lagi global pasif udah ada di genshin kayak talent biar nurunin harga LV up senjata, bisa jalan di air, dan lain lain. udah main aja jangan mikirin global pasif",5,2025-04-12 14:05:28,0
Pengguna Google,"saya sangat suka dengan game ini , semenjak update 3.2 gamenya menjadi semakin seru dengan cut scene yang epic , story yang cukup panjang + menarik dan event yang bagus juga , jujur saya tidak terlalu menanggapi global phassive nya castorice karna itu tidak terlalu op juga , semoga gamenya di update kedepannya nanti bertambah bagus dari cut scene dan story nya juga , itu saja pendapat dari saya ðŸ™",5,2025-04-12 13:57:43,34
Pengguna Google,ðŸ‘,5,2025-04-12 13:56:12,0
Pengguna Google,"sistem gacha benar benar buruk, drop rate rendah rata rata butuh 70an draw lebih untuk mendapatkan karakter bintang 5, udah gitu banyak karakter kena power creep parah, gk ramah banget untuk player gratisan, game pay to win parah. benar benar mengecewakan",1,2025-04-12 13:53:58,0
Pengguna Google,"cerita dalam trailblazer quest versi 3.2 itu sangat panjang, membosankan, gak jelas, percakapannya dibuat berkelok-kelok, menggunakan kalimat ribet supaya kelihatan keren kayak anak kurang perhatian. dengan kata lain sampah. 1/10",1,2025-04-12 13:53:33,0
Pengguna Google,gamenya bagus..saya jadi semangat saat memainkan game ini..mohon perkembangan dari game ini agar tetap maju dan dapat mempermudah para pemain game ini dan membantu para f2p,5,2025-04-12 13:50:08,0
Pengguna Google,gacha ampas,1,2025-04-12 13:46:33,0
Pengguna Google,gabuts,5,2025-04-12 13:40:35,0
Pengguna Google,mendingan lah ðŸ˜…,5,2025-04-12 13:27:13,0
Pengguna Google,menurutku dari segi cerita HSR bagus banget sih apalagi pas arc penacony banyak plot twistnyaðŸ¤­,5,2025-04-12 13:27:00,1
Pengguna Google,Ga tau kenapa suka aja,5,2025-04-12 13:15:36,0
Pengguna Google,"games nya bagus saya suka, walaupun agak susah main nya tapi enjoy kok :)",5,2025-04-12 13:15:18,0
Pengguna Google,game baik,5,2025-04-12 12:51:49,0
Pengguna Google,game baik,5,2025-04-12 12:51:10,0
Pengguna Google,gokil,5,2025-04-12 12:34:32,0
Pengguna Google,ga suka global passive? lawak klen,5,2025-04-12 12:21:45,0
Pengguna Google,"Terimakasih sudah membuat Waifu secantik The Herta, sebaik hati Firefly, dan Setulus Castorice",5,2025-04-12 12:15:09,0
Pengguna Google,gamenya sangat bagus dan estetikðŸ˜ŽðŸ‘,5,2025-04-12 12:09:27,0
Pengguna Google,tolong lebih ke friendly device ni game,5,2025-04-12 12:07:33,0
Pengguna Google,kok gak bisa masuk jirr,5,2025-04-12 11:48:04,0
Pengguna Google,gem baikðŸ¤—,5,2025-04-12 11:36:31,0
Pengguna Google,"Mayan hal layar hitamnya udah mulai dikit walupun di ganti layar putih sih, tapi gak papah tetap enjoy kok",5,2025-04-12 11:32:47,0
Pengguna Google,bagus udah itu aja,5,2025-04-12 11:21:20,0
Pengguna Google,Keren,5,2025-04-12 11:08:38,0
Pengguna Google,"bagus kok ini game. Bansos nya banyak, nguli gampang, Story absolute cinema. powercreep ga berasa kalo build nya benar. dan ya aku mau sign Casto, berada di pity 55 rate off ðŸ˜­ðŸ˜­ðŸ˜­",5,2025-04-12 11:07:35,1
Pengguna Google,Nice,4,2025-04-12 10:24:58,0
Pengguna Google,kata gw player f2p gausah banyak tingkah,5,2025-04-12 10:22:00,0
Pengguna Google,this is a perfect game,5,2025-04-12 10:04:10,0
Pengguna Google,best game yang pernah aku mainkan. Untuk beberapa isu kayak hp unflasion itu aku setuju juga tapi sebenarnya developer itu sendiri udah merilis karakter yang damagenya gede juga jadi imbang,5,2025-04-12 09:51:58,0
Pengguna Google,reward berlimpah,5,2025-04-12 09:38:21,0
Pengguna Google,"ak cinta hsr, selalu menang rate offðŸ˜œ",5,2025-04-12 09:36:54,0
Pengguna Google,Game terlalu mengandalkan topup,1,2025-04-12 09:28:25,0
Pengguna Google,setahun main ga pernah low pitty dan mayoritas hard o. lebih sering kalah rate off lagi. mungkin kalau lebih bagus gacha ku ku naikkan nih rating,1,2025-04-12 09:26:37,0
Pengguna Google,semuanya bagus ga ada masalah sama sekali sih di gua,5,2025-04-12 09:24:59,0
Pengguna Google,GAME SANGAT RAMAH PLAYER,5,2025-04-12 09:20:49,0
Pengguna Google,main tinggal main njir ribet amat,5,2025-04-12 09:19:31,0
Pengguna Google,niceðŸ‘Œ,5,2025-04-12 09:14:38,0
Pengguna Google,game wortit,5,2025-04-12 09:14:24,0
Pengguna Google,katanya yapping nya dikurangin malah ga ada perubahan !! battlenya minim banget char lama belum dibuffÂ² juga kalau gini terus jangan heran player protes,1,2025-04-12 09:09:35,0
Pengguna Google,"makin lama main ni game, makin boring, endgame konten yg terlalu spesifik buat char baru, makin maksa player buat topup dan powercrepp nya gila",3,2025-04-12 09:01:41,0
Pengguna Google,KALAH RATE OFF MULUðŸ˜ðŸ˜,1,2025-04-12 08:59:19,0
Pengguna Google,"pasti klo hero op gacha ga pernah dpet, pelit banget sih -_-",3,2025-04-12 08:49:01,0
Pengguna Google,Hoyo berikan aku CastoriceðŸ˜­ðŸ˜­ðŸ˜­,5,2025-04-12 08:46:46,0
Pengguna Google,sering gk bisa masuk game,1,2025-04-12 08:34:32,5
Pengguna Google,dah lah ga di kasi castorice,1,2025-04-12 08:33:39,0
Pengguna Google,bansos nya kurang minðŸ˜‚ðŸ˜‚,1,2025-04-12 07:59:47,0
Pengguna Google,kurangi powercreep nya,5,2025-04-12 07:48:22,0
Pengguna Google,"terkadang kalau login selalu eror, tolong dong...",4,2025-04-12 07:22:40,0
Pengguna Google,gamenya bagus alurnya juga lumayan kalo bisa banyakin lagi haremnya Rover.,5,2025-04-12 07:03:33,0
Pengguna Google,game nya bagus tapi storynya kebanyakan yapping dibanding battle nya jadi kayak 80% yapping 20% battlenya tolongbuat devnya kalo mau update storynya di seimbangin lagi yapping sama battlenya!,3,2025-04-12 06:41:51,0
Pengguna Google,weee mantap gamenya cocok sama aku,5,2025-04-12 06:17:08,0
Pengguna Google,mantap,3,2025-04-12 06:15:02,7
Pengguna Google,Terima kasih untuk Honkai: Star Rail karna telah menemani hari hari saya,5,2025-04-12 06:13:16,0
Pengguna Google,powercreep argh...,5,2025-04-12 06:03:47,0
Pengguna Google,yapping mulu,1,2025-04-12 05:59:15,0
Pengguna Google,game seru,5,2025-04-12 05:52:54,0
Pengguna Google,castorice the besttttttttâ¤ï¸,5,2025-04-12 05:42:55,0
Pengguna Google,udah kalah rate off hard pity SJ seret pula,2,2025-04-12 05:30:19,0
Pengguna Google,bilangin ke hoyo makasih udah ngasih aku gacha yg hoki ðŸ¥°,5,2025-04-12 05:23:52,0
Pengguna Google,tolong untuk puzzlenya sedikit dipermudah,4,2025-04-12 05:17:06,0
Pengguna Google,i love CASTORICE,5,2025-04-12 05:16:51,1
Pengguna Google,game nya bagus banget kalian harus nyobain bisa jadi wibu,1,2025-04-12 05:04:23,0
Pengguna Google,ðŸ™,5,2025-04-12 04:50:00,0
Pengguna Google,bantai bocil fomo,5,2025-04-12 04:46:36,0
Pengguna Google,makasih hoyo sudah membuat saya merasakan menang rate off,5,2025-04-12 04:42:27,0
Pengguna Google,semangat mang hoyo walaupun banyak bocil fomo,5,2025-04-12 04:36:04,0
Pengguna Google,"Untuk gameplay, animasi, story dan character. Hoyoverse dah gak usah di tanya lah ya. Dan cukup baik dalam gift bansosnya untuk player yang baru instal seperti saya. Udah segitu aja hehe",5,2025-04-12 04:28:14,18
Pengguna Google,nice,5,2025-04-12 04:18:45,0
Pengguna Google,very very good game,5,2025-04-12 04:12:14,0
Pengguna Google,"Yang rating 1* karena fomo mending gausah main dah. Yang rating 1* karena ngeluh global passive, lu skill issue ngapain jadi budak meta. Yang rating 1* karena gacha hard pity kalah rate off terus, gapapa anda rekan saya emg pntk kali gachanya",5,2025-04-12 03:56:06,1
Pengguna Google,Game sampah dikira habis banyak yang rate bagus seenaknya membuat akun kena too much request atau resiko keamanan. Dikira pemain suka buat akun lalu kena itu bilang lah penyebabnya apa kenapa bisa kena 2 itu jangan asal kenain. Game sampah Ga layak dikasih rate tinggi kalau dibiarin akun kena bug login atau tiba tiba kena banned kasih alasan yang jelas. Aku akuin banyak giveaway tapi kalau dibiarin kayak gini jadi Dead game pasti ga lama lagi gamenya. Tolong perbaiki tuh sistem jangan asal ban,1,2025-04-12 03:36:58,0
Pengguna Google,game nya menarik,5,2025-04-12 03:28:41,0
Pengguna Google,"overall dari segi cerita, character, dan lain-lain sdh bagus. Untuk story Amphoreus, cerita ini lbh hype menurut saya krn hampir mirip dengan cerita Flame-chaser yg ada di HI3",5,2025-04-12 03:22:30,0
Pengguna Google,"walau aku selalu kalah rate off dan selalu hard pity. tapi itu mengajarkan ku experience baru, melatih mental dan kesabaran ku. aku juga main hsr ini karena 2 wanita yang ada di dalamnya. terimakasih mihoyo telah menciptakan merekaðŸ«¶ðŸ»",5,2025-04-12 03:21:14,0
Pengguna Google,power creep gaca ampas,1,2025-04-12 03:10:50,0
Pengguna Google,mantap,5,2025-04-12 02:48:37,0
Pengguna Google,mantap story nya,5,2025-04-12 02:34:51,0
Pengguna Google,game rpg terbagus!!!!,5,2025-04-12 02:11:21,0
Pengguna Google,kenapa harus Anaxa ku yg jdi mayad minðŸ˜­ðŸ¤¬,5,2025-04-12 01:42:21,0
Pengguna Google,"gem baik, banyak waifu cantik jugaðŸ¥°ðŸ¥°",5,2025-04-12 01:40:59,0
Pengguna Google,ganbate,5,2025-04-12 00:42:26,0
Pengguna Google,2 kali kalah 50 50 back to back saya f2p dah lah,1,2025-04-12 00:14:40,0
Pengguna Google,F2p kok ngatur ðŸ˜‚,5,2025-04-11 23:47:14,0
Pengguna Google,AKUN GW MANA MASA USER EMAIL DAN SERVER SAMA TAPI BEDA LAGI,1,2025-04-11 23:43:24,0
Pengguna Google,"saya main dari map di jarilo sekarang sudah di amphoreus, semakin kesini story semakin boring, story sih bagus tapi kenapa boring? kebanyakan dialog jarang cutscene, bahkan kalau ada flashback cuma dibuat gambar dan tulisan saja, masa game sekelas mihoyo susah amat buat cutscene? kekurangan dana atau gimana? dari sekian banyak player topup tolong manjakan kami dengan cutsene jangan story full percakapan saja kaya kekurangan dana gini parah",1,2025-04-11 23:39:12,102
Pengguna Google,aku sayang castoriceðŸ˜,5,2025-04-11 23:33:09,0
Pengguna Google,nggak ngurus power creep yang penting dapat bansosðŸ˜‹,5,2025-04-11 23:23:36,0
Pengguna Google,"dapet casto low pity, layar putih yang mantapðŸ‘ dan story sekarang yg ok lh",5,2025-04-11 23:04:47,252
Pengguna Google,"terimakasih kepada honkai star rail yg udah kasih saya 3 character limited dengan rate off dan berturut2, ga nyangka dpt nya kayak gitu.",5,2025-04-11 22:59:45,0
Pengguna Google,bismillah,5,2025-04-11 22:56:08,0
Pengguna Google,setelah update terbaru game saya suka banget force close padahal di gamemode event saja bukan in fight dengan animasi. tolong lah diperbaiki sudah berkali kali. belum lagi permasalahan powercreep bikin ga nyaman,1,2025-04-11 22:17:50,28
Pengguna Google,"6 jam story cuma buat 200 an jade tf bro, ga sesuai ngabisin ber jam cuma buat 200 an doang bahkan 2x pull aja ga bisa, ayolah gw tau ni game ga pelit tapi lebih masuk akal lagi lah story ber jam jam dan hadiah yg di dapet kurang cocok, phase story nya juga lelet bnyk cut scane dikit, bnyak Black screen trus voice sama subtitle, improve lagi lah hoyo",1,2025-04-11 22:06:56,1
Pengguna Google,game busuk,1,2025-04-11 22:04:49,0
Pengguna Google,setelah update jadi ga perlu lama lama nunggu dilayar hitam biasanya habisin 4-5 lagu dulu baru masuk in game mantap hayo,5,2025-04-11 21:55:14,0
Pengguna Google,ðŸ‘,5,2025-04-11 21:52:37,0
Pengguna Google,"Tetap dengan powercreep yg cepat, banyak karakter lama yg gak kepakek lagi, harus banget gacha light cone karakter jika tidak dmg turun dratis, story mulai panjang tapi kualitas story telling buruk, sering black screen,dialog bertele-tele.",1,2025-04-11 19:49:49,0
Pengguna Google,sangat bintang 0 HSR. akun saya dari bulan 11 gak bsa login. udah ngelapor ke CS disuruh coba secara berkala namun hingga saat ini ga ada konfirmasi lebih lanjut. saya ga pernah ngecheat atau make program ilegal lainnya. Tapi setiap ngelapor ga ada solusi.,1,2025-04-11 19:27:04,0
Pengguna Google,game dengan developer baik gini di spam bintang 1ðŸ˜¹,5,2025-04-11 19:21:22,0
Pengguna Google,bagus,5,2025-04-11 19:11:36,0
Pengguna Google,aku mo main tapi dev ga support ðŸ˜­ðŸ˜­,2,2025-04-11 18:30:18,0
Pengguna Google,update kali ini kenapa ya di aku yanqing nya ngebug? pas lawan yanqing itu selalu keluar paksa dan itu mau login ke dalam game pun susah,2,2025-04-11 17:51:47,0
Pengguna Google,game yg sangat bagus,5,2025-04-11 17:47:55,0
Pengguna Google,"game nya bagus banget... cmn kenapa akhir akhir ini gameplay sering ngeglitch ya, padahal HP ku juga baru beli, mohon diperbaiki",5,2025-04-11 17:32:23,0
Pengguna Google,"penyakit power creep gila, gacha castorice dikasih selee (mentang-mentang mereka berdua samaan sabit element quantum)",1,2025-04-11 17:30:40,0
Pengguna Google,"objektif, game ini baik bgt ke player ny, banyak bansos di update kemarin, dan dikasih B5 limited juga, dari segi story ny juga bagus, dan g full yapping, okelah, minusnya g ada fitur skip, adakan lah fitur skipnya",5,2025-04-11 17:15:33,1
Pengguna Google,give your attention to the male character too.,4,2025-04-11 17:00:00,1
Pengguna Google,kemana kah perginya hama perating b1 setelah claim bansos? ðŸ˜¹,5,2025-04-11 16:59:15,0
Pengguna Google,Always good game,5,2025-04-11 16:32:07,0
Pengguna Google,certa nya saat late game berantakan,1,2025-04-11 16:04:59,1
Pengguna Google,"makasih ya hoyo dan semuanya, aku dapat istriku (castorice) di low pity rate off ðŸ˜¹",5,2025-04-11 15:55:30,0
Pengguna Google,GIVE LUCK FOR PHAINON PULL LATER MIHOYOOOOOâ˜ðŸ»ðŸ¤“,5,2025-04-11 15:44:20,0
Pengguna Google,"sejauh ini bagus sih secara konten,story,dan gameplay yang simpel dan mudah di mengerti,Ama buat karakter lama jadi balance dong kasihan mereka udah susah di pakai di patch baru",5,2025-04-11 15:19:03,7
Pengguna Google,game lier,1,2025-04-11 15:07:09,0
Pengguna Google,dialog nya kurang panjang,1,2025-04-11 15:05:57,0
Pengguna Google,"Underwhelming 2nd anniversasy event, Castorice's global passive controversy, Always dodging and not improving the dialogue-animated scene even though have been pressured by the community many times (really, it's cringe because you always hide behind the sarcastic dialogue/decision to not improving these feedback) If Kuro were an idealist turned into incels sucker, Hoyo were an idealist tone deaf and turning every their game into cashcow (why it sounds hoyo is more good than Kuro)",2,2025-04-11 14:54:03,0
Pengguna Google,hoyo baik ngasih bansos gak kira kira dan kasih character b5 limited gratis gak kaya kakaknya,5,2025-04-11 14:41:29,0
Pengguna Google,"untuk castorice sangat bagus bisa disemua kondisi,dan ramah team f2p",5,2025-04-11 14:40:57,0
Pengguna Google,over all good,5,2025-04-11 14:29:51,0
Pengguna Google,"gila relic, kalah rate off terus, kebanyakan dialog",1,2025-04-11 14:23:51,22
Pengguna Google,Nice update mihoyo,5,2025-04-11 14:17:16,0
Pengguna Google,WHY DID YOU KILL MY WIFEEEE!!!ðŸ˜”ðŸ˜”ðŸ˜”,1,2025-04-11 14:09:23,0
