Nama Pengguna,Teks Ulasan,Rating Bintang,Tanggal Ulasan,Jumlah Likes
Pengguna Google,gak perlu komen banyak ini game bagus banget yg jelas,5,2025-04-08 10:13:10,0
Pengguna Google,game ini sangat nyaman dimainkan sebagai pelarian saat lose streak di game moba,5,2025-04-08 10:12:48,0
Pengguna Google,"saya telah memainkan game ini sejak pertama kali rilis dan saya sangat menyukai nya hingga saat ini. tetapi saya harus akui saya cukup kecewa dengan beberapa update belakangan ini dari mulainya inflasi hp boss endgame konten, penyampaian story yang berantakan, dan powercreep karakter lama. bukannya membenahi, developer malah menambahkan karakter yang dimana memiliki global pasive untuk membereskan masalah diatas... Saya sangat kecewa dengan game HSR.",1,2025-04-08 10:11:35,3
Pengguna Google,bagus,5,2025-04-08 10:11:27,0
Pengguna Google,tetap semangat,5,2025-04-08 10:09:07,0
Pengguna Google,"hmm izinkan mengasih saran buat yang mempermasalahkan global pasife yang takutnya selanjutnya ada char dgn global pasif, pihak mihoyo bisa mengasih bocoran terkait skil/pasif nya lebih cepat dari yang biasanya, biar bisa mengumpulkan jade nya lebih cepat dari awal rilis, kan banyak yang protes karena global pasif takut ga dapat chatnya jadi segitu saja",5,2025-04-08 10:07:00,0
Pengguna Google,game bagus bgt gini dapet rating rendah,5,2025-04-08 10:06:30,0
Pengguna Google,absolut cinema masterpiece,5,2025-04-08 10:06:19,0
Pengguna Google,"Sebagai pemain yang udah ngikutin Honkai: Star Rail dari awal rilis, bisa dibilang game ini bener-bener beda dari yang lain. Grafisnya cakep banget, desain karakternya detail dan penuh gaya, dan setiap update selalu ngasih sesuatu yang bikin penasaran. Ceritanya juga nggak main-mainâ€”serius, kadang kayak nonton anime dengan plot twist yang nggak ketebak. Ditambah lagi, musik latarnya juga keren, cocok banget sama atmosfer di tiap planet atau area yang kita jelajahi.",5,2025-04-08 10:03:58,4
Pengguna Google,"makin males main ni Game, mending genshin sih. akhirnya rehat sejenak dari game ini dan pindah ke wuwa ðŸ˜®â€ðŸ’¨",1,2025-04-08 10:01:47,1
Pengguna Google,entahlah tapi gamenya asik,4,2025-04-08 10:01:23,0
Pengguna Google,"gak peduli yang lain bilang apa , yang penting main",5,2025-04-08 10:01:09,0
Pengguna Google,THE BESTT NGENTODD,5,2025-04-08 09:59:23,1
Pengguna Google,"Kalian yg rating Honkai: Star Rail bintang 1 cuman gara-gara global passive nya Castorice. kalo kalian gk suka ya jangan di gacha karakter nya bodoh, jangan dengarkan playerÂ² bodoh itu developer",5,2025-04-08 09:58:10,0
Pengguna Google,"best game, bansos ngalir terus yang bilang p2w fomo nying",5,2025-04-08 09:55:02,0
Pengguna Google,plis menang rate off biar tidak ubah rating,5,2025-04-08 09:51:14,1
Pengguna Google,seru buat saya yg selalu ngikutin mihoyo ini gane sangat memuaskan,5,2025-04-08 09:49:40,0
Pengguna Google,game baikk nggak kayak kakaknya pelit,5,2025-04-08 09:49:24,0
Pengguna Google,"permainan ini sangat bagus dan menyenangkan jadi setiap hari gue mainin jadi suka, ini permainan yg bagus, semoga dapat update karakter yg lebih bagus lagi, sekian terimakasih",5,2025-04-08 09:44:00,0
Pengguna Google,Game terbaik dan banyak bansos,5,2025-04-08 09:41:11,1
Pengguna Google,game baik,5,2025-04-08 09:40:15,0
Pengguna Google,bagus kok gamenya walaupun msih ada minusnya ya sebagai penikmat game gw suka,5,2025-04-08 09:32:23,0
Pengguna Google,beri aku keberuntungan,5,2025-04-08 09:31:53,0
Pengguna Google,Inflasi hp tapi banyak Waifu 4/5,4,2025-04-08 09:31:40,0
Pengguna Google,gamenyaa bagus bangettt,5,2025-04-08 09:29:28,0
Pengguna Google,"bruh yg rating bintang 1 rataÂ² fomo, gw yg f2p aja gk masalah ama global passive. lagian kan ini game santai bukan game kompe",5,2025-04-08 09:28:11,1
Pengguna Google,pertahankan game keren ini,5,2025-04-08 09:21:07,0
Pengguna Google,"gue bingung ama rating, ini seriusan pemain hsr?? atau pada baru baru??? Yang lu cari dari game ini emang apa sih?? kalo gue pribadi, kaya genshin/game open world lainnya aja, gue penikmat story + relaksasi di dunia hoyoverse. kalau masalah global passive gue setuju HANYA untuk di MoC dan sejenisnya. Kalau untuk story menurut gue aman aman aja, asalkan sesuai dengan karakteristik musuhnya aja. Dan lu disediakan fitur GACHA, biarpun lu F2P lu bisa nabung kan?? cara banyak dapetin stellar jade!!!!",5,2025-04-08 09:20:48,0
Pengguna Google,good game for me,5,2025-04-08 09:20:48,0
Pengguna Google,"seruu banget,,,pliss Jan di hapus dari playstore dulu",5,2025-04-08 09:20:11,0
Pengguna Google,"semakin kedepan semakin harus dapat new karakter yang muncul, karakter lama jadi tidak berguna.......powercreep karakter terlalu cepat bung, gw ngikutin dari awal rilis baru ini kecewa berat,.....dah lah....",1,2025-04-08 09:20:00,6
Pengguna Google,game keren efek skill nya mewah,5,2025-04-08 09:15:42,0
Pengguna Google,"judi, bagus, seru, tapi adain fitur hapus quest dong, ini 21 gb apa ga membeludak penyimpanan nya, biarpun ada fitur pojok nostalgia tapi kalo player endgame udah kelar semua eventnya jadi menuh menuhin memori",4,2025-04-08 09:13:52,2
Pengguna Google,"no comment, just wonderful, one of the best game I ever played",5,2025-04-08 09:13:37,0
Pengguna Google,"global passive Castorice lumayan bagus juga, apalagi dapet musuh yang skilnya itu AoE. ngebantu Free to Play(F2P/FtP) juga tuh",5,2025-04-08 09:13:21,0
Pengguna Google,Menurut gw game bagus kok. Overall suka banget. Powercreep? Global passive? Bodo amat. Sejak main di versi 2.1 juga gw gak pernah terlalu peduli buat namatin endgame sampai full star. Jadi ya gw enjoy aja main ini game,5,2025-04-08 09:12:37,0
Pengguna Google,"terbiasa dengan nerf chara, pernah main kakaknya hi3 soalnya, jadi udah berpengalaman uwu. Hi3 kebanyakan nerf, chara sini di nerf udah dari awal.Contohnya seele, jadi jan ngeluh yagesya. entar makin banyak juga kok contohnya",5,2025-04-08 09:12:33,0
Pengguna Google,keren,5,2025-04-08 09:11:51,0
Pengguna Google,Game nya bagus,5,2025-04-08 09:10:45,0
Pengguna Google,"oke, sejauh ini lore dan cutscene bagus, paling cuma minus di peforma aja bagi yang device gak kuat, tapi itu juga bukan urusan developer ðŸ˜‚. Untuk skill, desain dan talent karakter udah bagus semuaðŸ˜Š. Dan bahkan, bisa dibilang ini adalah salah satu game terbaik yang ada di Multi Platform, terutama game yang masih support platform tingkat menengah.",5,2025-04-08 09:09:12,0
Pengguna Google,game terbaik: bye Ramaa,5,2025-04-08 09:05:13,0
Pengguna Google,"perbanyak cut scene dalam gamenya Dev, kalau tidak bisa tolong tambahkan fitur skip untuk misi selain trailblaze missionðŸ™",5,2025-04-08 09:03:47,0
Pengguna Google,keren,5,2025-04-08 09:02:27,0
Pengguna Google,"thanks for made this game, i love it",5,2025-04-08 08:57:50,0
Pengguna Google,"enggak mau bertele tele, game nya bagus, and done, what alse?buat yg enggak suka global passive nya, I don't care what you guys thinking. ini game dan developer pasti udah berpikir apa yg mereka tambahkan di game mereka, sebagai player harusnya mendukung, kalau emang gk bisa dapat karena lu f2p, jangan main ni game, gak semua konten end game gak bisa lu selesaiin dengan character yg lu mau, intinya ada di mindset sendiri",5,2025-04-08 08:56:14,1
Pengguna Google,Terima kasih game baik,5,2025-04-08 08:46:47,0
Pengguna Google,"ini game bagus aja kok, asalkan gk dibawa pusing dan have fun aja. ingat ini game buat ngurangin stress, bukan nambahin stress",5,2025-04-08 08:45:14,0
Pengguna Google,story nya bagus dan karakternya bagus,5,2025-04-08 08:44:31,0
Pengguna Google,Powercreep gila gilaan,1,2025-04-08 08:42:19,4
Pengguna Google,"bagus gamenya storynya seru seru ,ngak usah dengerin orang yang suka ngeluh soal story kepanjangan lah ,inilah itulah ,mereka itu orang yang malas baca dan skip storyðŸ¤£ðŸ¤£ðŸ¤£",5,2025-04-08 08:40:09,0
Pengguna Google,"Nice game, but if i lost my 50/50 please i need himeko",5,2025-04-08 08:39:07,0
Pengguna Google,nice game tapi..... yttta,5,2025-04-08 08:36:22,0
Pengguna Google,jelek powercreep makin banyak,1,2025-04-08 08:33:20,4
Pengguna Google,powercreep dan yapping,1,2025-04-08 08:27:50,4
Pengguna Google,"bagus banget gamenya, udah lama gak maen game turn base, main dari awal banget rilis sampe ganti"" devices biar bisa maen ampe sekarang. klo emang gak mampu, ato mo ada skip story, ini game bukan game kompetitif. di pikir pakai 2 kli deh kalian. terima kasih, game hsr game baek",5,2025-04-08 08:26:26,1
Pengguna Google,"Pls jgn EoS dulu yahðŸ¥º, percuma dong gw top up",5,2025-04-08 08:26:03,0
Pengguna Google,"maen tinggal maen ngga suka ya tinggal pensi gitu doang di permasalahin,ikutin aja gk sih brok alurnya.",5,2025-04-08 08:25:52,0
Pengguna Google,mending fomo bintang 5 daripada fomo bintang 1 ðŸ¤­,5,2025-04-08 08:25:46,0
Pengguna Google,game baik dev bakk bansos banyak sehat sehat ya,5,2025-04-08 08:22:17,0
Pengguna Google,penyakit powercreep gila,1,2025-04-08 08:22:07,4
Pengguna Google,"kalian ini kenapa si pada fomo"" tentang global pasive castorice padahal kalau gasuka ya gausah digacha repot banget lagian ini game juga enak ngga pelit bansos kalian aja yang alay ini itu blablabla main tinggal main nikmati aja yang Uda dikasih repot banget ini yang rate B1 kebanyakan player game kikir",5,2025-04-08 08:20:31,0
Pengguna Google,mantap,5,2025-04-08 08:12:18,0
Pengguna Google,ðŸ‘ðŸ»ðŸ‘ðŸ»ðŸ‘ðŸ»,5,2025-04-08 08:10:43,0
Pengguna Google,tolong atasi masalah power creep nyaðŸ™ðŸ¼,5,2025-04-08 08:09:45,0
Pengguna Google,game bagus yang rating 1 karbit fomo semua,5,2025-04-08 08:06:15,0
Pengguna Google,kenapa orang orang pada fomo?,5,2025-04-08 08:04:28,0
Pengguna Google,ini game bagus woi,5,2025-04-08 08:02:57,0
Pengguna Google,bagus hadiah nya bisa dibanyakin lagi ya,5,2025-04-08 08:01:36,0
Pengguna Google,Dev listen the community please,1,2025-04-08 07:59:17,2
Pengguna Google,gamenyaaaa seruu :3,5,2025-04-08 07:58:36,1
Pengguna Google,suka turn base atau suka gameplay yg mikir udah sih itu aj,5,2025-04-08 07:57:48,0
Pengguna Google,"gamenya bagus walaupun battlenya rumit banyak powercreep tpi gw biasaÂ² saja, yg kurang cuman fitur lompat sih",5,2025-04-08 07:55:55,0
Pengguna Google,ini orang fomo kenapa jir ðŸ˜¹ðŸ˜¹,5,2025-04-08 07:54:21,0
Pengguna Google,"dari awal ini game rilis udah bagus banget,buat developer tetap semangat dalam mengembangkan game ini kedepan nya",5,2025-04-08 07:54:12,0
Pengguna Google,"Game nya seruuu, walau aku cuman f2p tapi masih bisa enjoy gamenya. fanservice yang dikasih juga ga pelit, love you hoyoo",5,2025-04-08 07:51:17,0
Pengguna Google,"Saya masih mainin hsr hingga saat ini dan tetep suka dengan game & story nya tapi semenjak 2.4 keatas menurut saya gamenya semakin sulit seperti kenaikan hp musuh/hp inflation dan perkembangan cerita yang terlalu biasa walau story dan cutscene nya keren. Terlebih MoC lt 10 keatas membuat karakter lama jarang terpakai dan mengharuskan menggacha karakter baru. Untuk reward lumayan tetapi event sangat sedikit, segitu sja ulasan dari saya.",4,2025-04-08 07:49:50,12
Pengguna Google,hp inflasi gila,1,2025-04-08 07:46:47,5
Pengguna Google,Ni game bagus cok nggak kaya kakak nya,5,2025-04-08 07:44:06,0
Pengguna Google,nice game,5,2025-04-08 07:35:28,0
Pengguna Google,"Terima kasih telah menemani hari saya yang membosankan. main ni game karena kesepian, And sometimes i play this game to calm myself from my anxienty. thanks hoyo:)",5,2025-04-08 07:32:52,0
Pengguna Google,dasar para pemain banyak maunya. perusahaan game juga mau untung. sesusah apa menikmati hasil kerja keras orang? tinggal main aja banyak tingkah. yang namanya dunia bisnis itu ada strategi pasar biar gak jadi game mati.,5,2025-04-08 07:28:31,0
Pengguna Google,ðŸ‘ðŸ‘ðŸ‘ðŸ‘,5,2025-04-08 07:22:37,0
Pengguna Google,"sebagai player yang main dari awal rilis jujur kecewa. QoL sih bagus, bansos lancar tapi hp inflation nya kaga ngotak. makin ke sini udah mirip game kakaknya yang ogah dengerin masukan player. gws deh.",1,2025-04-08 07:17:16,12
Pengguna Google,pada fomo jir bintang satu ðŸ˜¹ aku mendukung penuh global passive (gw ganti ke satu kalo gak dapet casto ðŸ¤­),5,2025-04-08 07:13:07,10
Pengguna Google,game nya bagus banget saya suka ðŸ‘,5,2025-04-08 07:12:19,0
Pengguna Google,semangat hoyo,5,2025-04-08 07:06:35,0
Pengguna Google,gacor,5,2025-04-08 07:04:08,0
Pengguna Google,bansosnya gacor,5,2025-04-08 07:02:36,0
Pengguna Google,"game nya seru, story nya bagus juga tolong tambahin lagi story nya ya Mimin hoyo plis",5,2025-04-08 07:00:11,0
Pengguna Google,"mantap, seru, menyenangkan",5,2025-04-08 06:58:56,0
Pengguna Google,kasih rating 5 sebelum banner 3.2 bismillah castorice (asia server nick Nnote),5,2025-04-08 06:58:45,0
Pengguna Google,"game ini bagus, karakter,skil,effect, dan battle nya yg turn base yg santay meskipun kadang bosen,tapi ini game kalo dari powercreep dan hp inflasion musuh nya ya lumayan cepat dan Yap namanya juga game gacha meskipun begitu, hsr harus mengurangi powercreep dan hp inflasion agar f2p tidak kesusahan dalam clear end game konten tolong admin dengarkan kan saran/kirtikan dari player, jng player mainland aja yg di denger ðŸ˜•",5,2025-04-08 06:53:14,0
Pengguna Google,"story slalu berkembang (lebih menarik) sejak patch 2.0 masuk patch 3.0 cerita ga kalah menarik, mekanik game turn based biasa. visual dan animasi character keren. terus berkembang, jangan tutup potensi game ini",5,2025-04-08 06:48:11,7
Pengguna Google,yaa beginilah yaak nasib komunitasnya rata rata budak meta (pdhl bukan game compe njirr),5,2025-04-08 06:47:55,0
Pengguna Google,"For developers, please consider old characters with new characters. Don't prioritize new characters with new characters. Old characters want to shine again if Honkai Star If you want it to be crowded again, please buff the old characters or buff the old characters and one more thing for developers, don't prioritize new characters. Even players who don't top up their money still want to play with their old characters.",1,2025-04-08 06:45:31,3
Pengguna Google,"aku suka banget sama game nya. sebagai lore player, aku ga sama sekali bosen sama story questnya, dan ga terlalu mentingin char, tapi kalau bisa dialognya jangan terlalu banyak, alhasil bikin ngantuk, dan juga tolong powercreep nya di benarkan dan lain lainnya. lov lov sama game nya, semoga Hoyo dengerin keluhannya :3",5,2025-04-08 06:41:24,1
Pengguna Google,game seru gila!! gausah peduliin tuh yang rating b1,5,2025-04-08 06:40:38,1
Pengguna Google,"Game bagus, papi hoyo aku rate bintang 5 minta 500.000 Stellar jades plisss",5,2025-04-08 06:38:45,0
Pengguna Google,"padahal game nya bsgus, cuma gara"" dialog doang banyak dari pada cut shene.",5,2025-04-08 06:35:57,0
Pengguna Google,"if you want to enjoy the game, stay away from the fandom",5,2025-04-08 06:24:43,0
Pengguna Google,"tolong lebih perbanyak aja cutscene nya karena kalau kebanyakan dialog doang,bosan rata2 player cuman itu2 doang, lalu tolong tambahkan event lebih banyak atau bansos lebih banyak karena kami sebagai player terbatas dapatin stellar jade,tolong kerja samanya Dev dan tim!ðŸ‘",3,2025-04-08 06:20:18,0
Pengguna Google,Gamenya bagus sih tapi lu harus pinter-pinter Inves ke arah support. Btw yang rating bintang satu Fomo ðŸ˜¹,5,2025-04-08 06:19:58,0
Pengguna Google,"plot storynya keren, damage bolehlah. untuk powercreep nggk terlalu ngaruh tergantung personalitinya mau diatur team kek gimana.",5,2025-04-08 06:19:35,0
Pengguna Google,buatkan fitur bikin anak ðŸ˜€,1,2025-04-08 06:19:21,4
Pengguna Google,Game baik,5,2025-04-08 06:18:54,0
Pengguna Google,gk sbr nunggu castorice ðŸ˜œðŸ˜‹ðŸ˜‹,5,2025-04-08 06:16:55,0
Pengguna Google,semoga saya lebih banyak dapet karakter limited di rate off,5,2025-04-08 06:10:11,1
Pengguna Google,"fitur skip story harus ada.. karna apa? sebagian pemain adalah para pekerja yang tidak mempunyai banyak waktu untuk bermain game dan hanya bisa menikmati gameplaynya saja, bukan berarti mereka tidak suka pada ceritanya tapi mereka lebih suka membahas cerita di komunitas,youTube,tiktok dll",3,2025-04-08 06:10:02,0
Pengguna Google,"Saya harap HoYoverse tidak membatalkan global passive milik Castorice. Itu adalah bagian yang membuat karakter ini unik dan menarik. Banyak pemain sudah menantikan kehadirannya dengan skill tersebut. Tolong pertahankan originalitas dan daya tariknya seperti di versi awal. Jangan kecewakan komunitas yang sudah excited!, JANGAN DENGARKAN MEREKA!!",5,2025-04-08 06:05:00,1
Pengguna Google,"OrangÂ² aneh pada gamau ngikutin zaman ama pembaruan, kayak global passive Castorice itu termasuk hal baru, eh malah orangÂ² dungu pada gamau ngikutin hal baru begituan, dikira bakal Castorice doang yg dapet global passive? Suatu saat juga bakal ada karakter yang punya global pasive juga, lagian juga ga ngerugiin apaÂ² kecuali orang issue banyak mau ðŸ‘‰ðŸ»ðŸ˜‚ðŸ‘ˆðŸ» berhenti MÌ¶iÌ¶sÌ¶kÌ¶iÌ¶nÌ¶ berfikir di dalam kotak.",5,2025-04-08 05:52:24,0
Pengguna Google,"Game jomok,ga jelas mcnya ga konsisten.ini game jualan Waifu atau jualan porno sampe story aja MC ga ada yg jelas...kek NPC rasanya,Fandom public Enemy ya gini",1,2025-04-08 05:51:59,2
Pengguna Google,Gua gak peduli GLOBAL PASSIVE DAN APAPUN KELUH KESAH KALIAN SEKIAN DASAR FANDOM TOXIC DAN TABTRUMAN,5,2025-04-08 05:50:18,0
Pengguna Google,fomo,1,2025-04-08 05:49:46,1
Pengguna Google,game bagus pertahankan,5,2025-04-08 05:49:12,0
Pengguna Google,"hard pity, no radiance pity",4,2025-04-08 05:48:28,0
Pengguna Google,ðŸ‘,5,2025-04-08 05:40:11,0
Pengguna Google,"gara"" global pasif banyak karakter limited lama jadi lemah semua gak bisa di pakai lagi di update terbaru kecewa player nya",1,2025-04-08 05:39:54,1
Pengguna Google,tambahin fitur skip dong terlalu banyak dialog gak penting,1,2025-04-08 05:38:13,4
Pengguna Google,semangat min,5,2025-04-08 05:37:12,0
Pengguna Google,"I don't know what people think, but this game is really good",5,2025-04-08 05:33:58,0
Pengguna Google,"untuk saat ini gw baikan dulu, kalo lu kasih gw hard pitg lagi, twlah apa yang akan terjadi",5,2025-04-08 05:27:56,3
Pengguna Google,"game seru,bisa main sambil tidur lagi ðŸ˜‹",5,2025-04-08 05:26:06,0
Pengguna Google,banyak bansosðŸ˜‹,5,2025-04-08 05:25:47,0
Pengguna Google,banyak bug,1,2025-04-08 05:24:08,2
Pengguna Google,"""Keren banget! Karaktermu bener-bener jadi tulang punggung tim. Setiap kali dia ulti, langsung bikin musuh gemeter! Desainnya elegan, skill-nya mematikan, dan auranya tuh... nggak ada lawan!""",5,2025-04-08 05:23:46,0
Pengguna Google,bagus bettttt,5,2025-04-08 05:17:18,0
Pengguna Google,game jualan karakter+power creep nya gila2an,1,2025-04-08 05:14:39,4
Pengguna Google,"game terbaik,sakarang sudah tidakðŸ¥²",5,2025-04-08 05:13:19,0
Pengguna Google,"I love this game so much, keep up",5,2025-04-08 05:12:10,0
Pengguna Google,kebanyakan mondar mandir di map bikin ngantuk jalan jauh harusnya ada auto quest aja.,1,2025-04-08 05:06:59,4
Pengguna Google,"Kebanyakan yang Rating b1 ga tau apa"" cuma asal komen tapi ga main ðŸ¥±",5,2025-04-08 05:06:26,0
Pengguna Google,"ngapain ikutan fomo spam"" â­1, mending lanjut nguli ae para F2P",5,2025-04-08 05:02:31,1
Pengguna Google,gamenya seru sayangnya playernya kebanyakan drama sdh free to play banyak maunya ðŸ˜„,5,2025-04-08 05:01:36,0
Pengguna Google,fomo rating *1 ðŸ¤¡ðŸ¤¡,5,2025-04-08 04:58:55,0
Pengguna Google,nikmatin aja game nya,5,2025-04-08 04:58:53,0
Pengguna Google,nikmatin gamenya aj.. gaperlu jadi manusia fomo,5,2025-04-08 04:58:45,0
Pengguna Google,tolong dong kasih skip dialognya ðŸ—¿ jangan malah d panjangin,5,2025-04-08 04:58:09,0
Pengguna Google,have fun aja enak buat sampingan kalo bosen,5,2025-04-08 04:57:06,0
Pengguna Google,"aku gak tau apa yang terjadi di sini overall game nya bagus aja karakter baru belum liris udah hujat aja kalo karakter baru nya udah liris kan nanti ada perubahan kalo ada karakter baru ,makanya aku gak terlalu ngikutin meta karena lebih enak buat meta sendiri karena enak sambil mencoba untuk global passiv menurut aku ya keunikan karakter lagian aku sebagai f2p kayak nya ok ok aja",5,2025-04-08 04:53:18,1
Pengguna Google,"trims mihoyo tlah membuat char tjkep sprti aventurine ðŸŽ€ðŸŽ€ðŸŽ€, ily mamang hoyo (bismillah menang rate off 10Ã—)",5,2025-04-08 04:50:13,0
Pengguna Google,npc si hsr lebih hidup dan berbeda-beda dan tentu nya developer yang sering memeberikan gacha gratis ðŸ˜‹ðŸ˜‹,5,2025-04-08 04:50:10,0
Pengguna Google,game nya cukup seru,5,2025-04-08 04:46:39,0
Pengguna Google,bad game and bug,1,2025-04-08 04:46:25,4
Pengguna Google,powercreep gila,5,2025-04-08 04:45:43,0
Pengguna Google,"game bagus, saya suka firefly",5,2025-04-08 04:45:21,0
Pengguna Google,"walaupun game turn base, tapi lumayan seru untuk dimainkan, story juga sangat bagus, cuma satu aja masalahnya, di power creep, karena inflasi hp musuh terlalu tinggi, karakter lama jadi gak bisa dimainkan",5,2025-04-08 04:44:30,2
Pengguna Google,GAMENYA BAGUS BANGETTTðŸ˜»ðŸ«¶ðŸ»,5,2025-04-08 04:42:17,1
Pengguna Google,fomo fomo,5,2025-04-08 04:41:55,2
Pengguna Google,game yang bagus,5,2025-04-08 04:33:25,0
Pengguna Google,"ini kok tiap kali melakukan pra unduh data buat next patch selalu saja bertambah penyimpanan datanya ni apk, kok lama lama lucu ya capek saya unduh berkali kali biar datanya normal, tolong di fix",1,2025-04-08 04:33:00,4
Pengguna Google,bguss,5,2025-04-08 04:31:05,0
Pengguna Google,"bagus, cuma masalah powercreep dan Inflasi Hp tolong di kondisikan ya manis â€¢///â€¢",5,2025-04-08 04:30:59,0
Pengguna Google,masalah GLOBAL PASSIVE aja dipermasalahin padahal cuman game turn base bukan kompe,5,2025-04-08 04:20:07,2
Pengguna Google,tambahkan fitur nikah ama furina dong min,5,2025-04-08 04:18:52,0
Pengguna Google,"Game yang terstruktur rapih baik dalam story dan juga design char yang unik ga monoton, tolong kurangi dialog tidak perlu, dan end game konten sedikit dipermudah apabila gagal berkali kali , untuk mempermudah player menyelesaikan konten tsb, dan semoga buff untuk char lama segera di optimalisasi agar bisa bersaing dengan char lain yang baru hadir, sisanya bagus banget dari bansos developer, ramah F2P dan sebagai nya, terimakasih hoyo â¤ï¸",5,2025-04-08 04:16:48,7
Pengguna Google,"booring, tolong setiap pergantian patch quest yang diberikan menjadi 30 agar tidak booring",2,2025-04-08 04:15:54,2
Pengguna Google,Game bagus ini gua dukung apapun yang dilakukan develoment untuk mengembangkan game ini lebih baik lagi dari sebelumnya,5,2025-04-08 04:12:32,0
Pengguna Google,"overall bagus kecuali black screen saat story dan sistem powercreep yg ga ngotak dn juga yang salahin global pasif,lo alay bro norak bangetðŸ˜‚",5,2025-04-08 04:09:28,0
Pengguna Google,"storynya boring, g bsa di skip lagi. bikin malas main",2,2025-04-08 04:06:27,10
Pengguna Google,tolong perpanjang dialognya ðŸ™„,5,2025-04-08 04:06:03,0
Pengguna Google,Gak Jelas Ngandalin Damage Gak Damage Gak Lanjut Story,1,2025-04-08 04:03:55,0
Pengguna Google,nice game,5,2025-04-08 04:01:19,0
Pengguna Google,game sangat bagus,5,2025-04-08 04:00:55,0
Pengguna Google,udah yapping ny tuk para player gk niat main,5,2025-04-08 04:00:45,0
Pengguna Google,Tolong Hilangin Efek Global Passive dan ubah passive nya hanya dapat digunakan saat berada di tim,1,2025-04-08 04:00:06,3
Pengguna Google,tolong dong powercreep .dan HP inflasi jangan terlalu ngebut. sedih lihatnya char lama cuma jadi sampah yg tidak bisa dipakai,1,2025-04-08 03:59:08,13
Pengguna Google,Save cassy,5,2025-04-08 03:58:32,0
Pengguna Google,game Yang Bagus Meskipun Update Amphreous Berat Tapi gakpapa lah,5,2025-04-08 03:57:15,0
Pengguna Google,"storynya menarik, grafik dan detailnya bagus. saking bagusnya sampe patahÂ² ðŸ—¿",5,2025-04-08 03:55:14,2
Pengguna Google,trash,1,2025-04-08 03:54:12,4
Pengguna Google,game bagus mantap,5,2025-04-08 03:47:53,0
Pengguna Google,gg geming,5,2025-04-08 03:42:47,0
Pengguna Google,"hsr ini memiliki story yang cukup menarik untuk diikuti akan tetapi ada beberapa bagian side story yang kurang menarik, maka dari itu saya harap untuk disediakan fitur tombol skip dialog pada story untuk memberikan kepuasan pada player yang kurang suka pada side story dan tetap membuat player yang menikmati setiap storynya tidak terganggu. dan juga pada pemberian jumlah HP yang terlalu tinggi di beberapa konten end game seperti MOC, pure fiction, dan apocalyptic shadow juga menjadi kendala.",3,2025-04-08 03:42:25,32
Pengguna Google,"Sudah bosan dengan story yang pajang dan berat untuk dipahami, dan karakter lama sudah kalah saing dengan karakter baru jadi tidak kepakai lagi",1,2025-04-08 03:41:50,10
Pengguna Google,tolong beberapa char di bagusi lagi animasi ultimate nya,5,2025-04-08 03:40:18,0
Pengguna Google,"ikutan ahh, biar rating tambah turun, jadi developer panik dan mulai mendengar keluh kesah warga",1,2025-04-08 03:38:55,4
Pengguna Google,gamenya overall bagus banget. tapi kalo bisa tambahin fitur skip story hehe,5,2025-04-08 03:37:41,0
Pengguna Google,jangan kehapus dari play store woi,5,2025-04-08 03:36:38,0
Pengguna Google,"sebenarnya ni game dari segi grafis, desain char dan story udh mantap tp yg bikin kurang nyaman mainya inflasi hp musuh yang terlalu tinggi dan untuk akun saya kalau soal hoki per gachan charnya saya lumayan kurang hoki berbeda sekali dengan saya bermain genshin yg selalu hoki trs saran saya untuk kedepannya lebih dipermudah aja gameplay ny SM puzzle nya jangan terlalu susahðŸ˜",4,2025-04-08 03:36:24,0
Pengguna Google,"salah satu game turn based terbaik dari segi animasi, gameplay dan mekanik(In My Opinion)",5,2025-04-08 03:32:12,0
