Nama Pengguna,Teks Ulasan,Rating Bintang,Tanggal Ulasan,Jumlah Likes
Pengguna Google,"baru sebulan gak main, balikÂ² udah gak ngotak kontennya nyelesain moc stage 10 pakai karakter 5* patch yg belum lama udah ngos-ngosan padahal pake sign lcnya apalagi pure fiction sama satu lagi gw lupa namanya di end stage yg biasanya bisa dilibas sekarang cuma mampu stage terakhir no 2 terlalu parah power creep di game ini bikin gak enjoy padahal udah main dari awal rilis jadi belum terasa keluhannya dulu tapi update baruÂ² ini bikin males lanjut lagi terlalu fokus sama whaler mending main wuwa",1,2025-04-06 17:42:57,0
Pengguna Google,"game bagus,yg bilang game kebanyakan powercreep itu skill issue",5,2025-04-06 17:41:45,0
Pengguna Google,you were my beloved,1,2025-04-06 17:41:12,0
Pengguna Google,"tolong update story jarilo vi, sudah lama menantikan sequel dari planet beku itu, dan berharap welt dapat panggung",5,2025-04-06 17:40:53,0
Pengguna Google,terlalu jelek,1,2025-04-06 17:32:41,0
Pengguna Google,Hebat,5,2025-04-06 17:16:27,0
Pengguna Google,please remove global passive,1,2025-04-06 17:11:35,2
Pengguna Google,"Meski jarang topup dengan nominal tapi gw rela beli device bagus cuma buat bisa mainin game hoyo dengan lancar tapi kali ini dikecewakan dengan game ini, gw berharap banyak karena ini game sekuel langsung dari honkai impact ternyata malah sama saja dari yapping parah dan kebiasaan power creep brutal dari HI3, kenapa enggak merilis 1 karakter saja setiap versi? Dari pada harus selalu melakukan hp inflation, terlebih gw khawatir kedepannya akan selalu rilis karakter dengan global effect. Kecewa ðŸ‘Ž",1,2025-04-06 17:09:03,16
Pengguna Google,"I like the game because the story is cool, especially ""penacony"" is a very plot twist, it deserves to be called peakcony, I really like it, can't wait for the continuation of Amphoreus' story.Thank you Hoyo for making such a cool game, keep up the spirit.",5,2025-04-06 17:07:04,0
Pengguna Google,tunggu ganti device otw main lagiðŸ˜‡,5,2025-04-06 17:04:53,0
Pengguna Google,Powercreep gila,1,2025-04-06 17:03:44,0
Pengguna Google,"Powercreep, hp inflasion, black screen, borong story",1,2025-04-06 17:01:51,8
Pengguna Google,"Semenjak update 3.0 entah kenapa selalu Force close keluar sendiri ketika animasi memulai pertarungan tolong(pas animasi retakan), makasih udh di fix sekarang udh ga pernah force close",3,2025-04-06 17:01:34,6
Pengguna Google,Game terbaik sepanjang awal rilis tidak pernah bosan,5,2025-04-06 16:58:41,0
Pengguna Google,"developer keras kepala, dari dulu banyak player ngeluh tentang HP inflation lah, Powercreep gila gilaan lah, beberapa kit char lama sering diambil sama char baru dan tentunya makin overpower,, padahal masalahnya dari dulu tapi giliran Global Passive rilis baru sadar playernya, hadeuh... seandainya di rate 3.0 masih ga di gubris, moga aja sampe 1.9 pun ga masalahðŸ˜‚ðŸ˜‚",1,2025-04-06 16:56:43,0
Pengguna Google,Hoep this game will get better from time to time,1,2025-04-06 16:52:01,0
Pengguna Google,banyak power creep sehingga karakter bintang 5 yg lama sudah tidak support battle lagi,1,2025-04-06 16:51:58,0
Pengguna Google,"tolong untuk developer, akun saya telah diretas dan pihak developer tidak memberikan respon apapun",1,2025-04-06 16:50:57,2
Pengguna Google,BRO INI GAME MASTERPIECE,5,2025-04-06 16:47:37,0
Pengguna Google,"WTH IS GOING ON WITH THIS GAME?! Castorice global passive is to much, WDYM YOU CAN REVIVE TEAM WITHOUT CASTORICE IN THEIR TEAM?! It's like this game just for castorice haver. And for castorice-less will be suffer?? And there's no more 4 star character (last is moze) and i'm sick of HP inflation. Bruh.. r u serious?? ðŸ˜®â€ðŸ’¨ i'm not gonna change this rate, until y'll fix this.",1,2025-04-06 16:40:30,0
Pengguna Google,BANYAKIN AJA KIKIRNYA KESEL BET GWA KELAMAAN STUCK Story,1,2025-04-06 16:30:34,0
Pengguna Google,"gw udh B5 rating, sekarang mana E6 S5 castorice nya wok haha",5,2025-04-06 16:29:14,2
Pengguna Google,game jualan g ngotak,1,2025-04-06 16:28:44,0
Pengguna Google,"Puas banget dengan game nya sebagai player nya di manjain terus story bagus,desain karakter,musik bgm sama ost, farm otomatis, banyak event, banyak bansos Bener bener puas banget sama honkai star rail",5,2025-04-06 16:27:14,0
Pengguna Google,hsr game pembaikðŸ¥°ðŸ¥°,5,2025-04-06 16:23:03,0
Pengguna Google,harusnya gak perlu lagi ku jelaskan,1,2025-04-06 16:11:23,0
Pengguna Google,really goodðŸ”¥ðŸ”¥ðŸ”¥ðŸ’–ðŸ’–ðŸ’–,5,2025-04-06 16:06:55,0
Pengguna Google,"game bagus gini kena spam *1 sama player g modal, mana fomo lagi",5,2025-04-06 16:05:03,0
Pengguna Google,"Game bagus, saya terhibur dengan game ini.",5,2025-04-06 16:04:44,2
Pengguna Google,maruk amat,1,2025-04-06 15:59:30,0
Pengguna Google,"bagus sih bagus aja, tapi jangan pilih kasihlah antara karakter cwe ama cwo prasaan karakter cewe terus yg dibuat bagus dan diprioritaskan",2,2025-04-06 15:59:29,1
Pengguna Google,Budeg sia,1,2025-04-06 15:53:19,0
Pengguna Google,hp inflation yang bikin aku pensi,1,2025-04-06 15:51:49,1
Pengguna Google,"power creep gila, feedback player jg ga didenger, cocok jadi 2.0 rating ni game",1,2025-04-06 15:44:37,0
Pengguna Google,bagus banget gemnya woi,5,2025-04-06 15:38:04,0
Pengguna Google,literally to much powercreep by only 2 patches,1,2025-04-06 15:36:30,0
Pengguna Google,GAME STRESSSS!!!!!,1,2025-04-06 15:36:27,0
Pengguna Google,global passive? well i still say it's good ðŸ¤£ðŸ¤£ðŸ¤£,5,2025-04-06 15:32:58,0
Pengguna Google,"Game turn base favorit, aku suka desain characternya yang buat minat main character baru update cepat tidak monoton dengan desain worldnya detail dan unik. Game ini ramah F2P main tidak keluarkan uang (top up) masih bisa dapat character yang kumau reward dari game cukup buat survive dan clear semua konten. Saranku sistem gacha untuk Ligt cone dihilangkan chance kalahnya 25% menjadi 0% atau 100% guarantee. Peluang 75% masih sering kalah dan ini yang buat aku mood main game ini turun. Terima kasih",5,2025-04-06 15:26:19,0
Pengguna Google,"penyakit powercreep gila parah tiap update patch karakter baru sengaja dibikin buat fokus jualan karakternya sampe yang lama sengaja diampasin biar gak relevan lagi dengan konten baru, di game laen gak separah ini powercreepnya bahkan make karakter lama juga masih bisa buat kelarin konten, liat aja bentar lagi fix bakalan jadi deadgame ini",1,2025-04-06 15:22:10,0
Pengguna Google,jelek,1,2025-04-06 15:19:11,0
Pengguna Google,bagus banget,5,2025-04-06 15:18:33,0
Pengguna Google,penyakit powercreep gila,1,2025-04-06 15:13:38,0
Pengguna Google,- You blink once and boom! powercreeps everywhere - HP inflation - Biased. This game treats the male characters poorly. You really think only waifus sell huh? You really like to give waifus good kits but keep nerfing or make bad kit for the male characters huh? - Lack of *4 characters HSR is getting really greedy. This is the greed that they talk about in the Bible.,1,2025-04-06 15:11:34,0
Pengguna Google,"Sorry for giving review 3 stars. ActualIy, I really love Amphoreus. Characters, stories, and interactions, all of them get my attention, especially for male characters (Phainon, Mydei and Anaxa). Yet, I don't like rumour global passive for one (or two) character. Also, nerfing another character is a cult. Another reason why I gave only 3 stars because when updating 3.0 until now, we don't get a new B4 character. Please take it seriously. Thank you.",3,2025-04-06 15:08:35,0
Pengguna Google,"power creep ny g ngotak, kadang wajib pull karakter, ga dapat, bisa mokad, g ad fitur bkin anak",1,2025-04-06 15:05:21,1
Pengguna Google,game terbaik,5,2025-04-06 15:05:11,0
Pengguna Google,"penyakit power creep gila, hp inflation yang gak ngotak",1,2025-04-06 15:05:01,0
Pengguna Google,"Sumpah gak expect game nya jadi begini. Suka banget ama jingliu dulu make dari v1.4 pas masih di atas terus. Versi sekarang di ajak nyelesain end game kontent, ah tau lah. Buff End Game content tiap patch spesifik New Character, Sekalinya udah punya Character DPS baru yang ""Meta"" Wajib LC Sign, trus team comp mahal, support spesifik. Banner Gacha tiap patch ada 8, susah loh mikirin gacha value nya.",1,2025-04-06 14:58:12,1
Pengguna Google,"sebagai penikmat story, game ini seru bangett",5,2025-04-06 14:52:45,0
Pengguna Google,"penyakit powercreep gila, b4 kurang bgt, chara cowo skillnya disunat trs hamdeuh",1,2025-04-06 14:51:23,4
Pengguna Google,"powercreep nggak ngotak, b4 makin dikit, hp musuh yg makin hari makin nggak ngotak kek developnya, dan munculnya global passive cuman demi ngejual karakter, yang bener aja, dikira semua org punya jade buat pull satu karakter itu, mana nggak perlu masuk di tim lagi, lamaÂ² ini game lebih ngandelin popularitas karakter daripada story game itu sendiri...",1,2025-04-06 14:42:26,0
Pengguna Google,powercreep gila,1,2025-04-06 14:41:53,0
Pengguna Google,gim powercreep,1,2025-04-06 14:40:28,0
Pengguna Google,Feedback player jarang didengar. Skip button masih gak ada. inflasi HP yang bikin unit lama gak relevan. Kualitas story yang bikin orang bosan. Global passive yang bikin makin predatory Anniversary rewards yang gak ada rasa rasa anniv. Trust player sudah hilang sama dev kalo begini terus.,1,2025-04-06 14:30:48,0
Pengguna Google,Global pasif no no,1,2025-04-06 14:30:16,0
Pengguna Google,game bagus,5,2025-04-06 14:24:21,0
Pengguna Google,penyakit power creep,1,2025-04-06 14:17:08,0
Pengguna Google,wow game ini sangat bagus sekali ðŸ‘,5,2025-04-06 14:16:10,0
Pengguna Google,HAPUS PASSIVE GLOBAL CASTO,1,2025-04-06 14:13:00,0
Pengguna Google,"game ini bagus gw player old dari 1.0, tapi gara2 banyak nya powercreep dan HP inflation banyak orang protes gak bisa kelar end game content, + malah nambah gara2 global pasif castorice yang bakal merombak mekanik di battle nya, aku sih oke2 aja selama gak semua char kedepannya bakal ada lagi minimal setiap char anniversary lah gitu, trus minimal jelasin lah gimana pasif itu bakal bekerja, gimana kalo dapat kondisi adanya char dengan global pasif baru kedua apa bakal numpuk atau ada opsi pilihan",3,2025-04-06 14:11:41,0
Pengguna Google,"sejak aniv kedua entah kenapa nih game makin ngawur, entah powercreep, hp musuh tebel, global pasif.",1,2025-04-06 14:03:35,0
Pengguna Google,makasih game baik saya selalu menang rate off ama sering dapet relic yang bagus semoga terus lancar bansos nya,5,2025-04-06 14:02:01,0
Pengguna Google,akun saya hilang karena quest monyet penacony :(,1,2025-04-06 14:01:21,1
Pengguna Google,"bansos, jgn KIKIR",1,2025-04-06 13:55:46,0
Pengguna Google,"Kecewa... pdhl udh berekspektasi tinggi... tapi amphoreus adalah tempat milkingnya counterpart dari character hi3 (flame-chaser) doang. mending fokus bikin story yg fresh kyk peaknacony kemarin. dah gitu bikin global passive yg cukup parah... seandainya itu global passive dibuat minor buff seperti menambah kecepatan lari character di eksplorasi, mungkin rating bomb ini gk bakal terjadi",2,2025-04-06 13:54:35,0
Pengguna Google,game baik,5,2025-04-06 13:50:54,0
Pengguna Google,remove global passive!,1,2025-04-06 13:47:01,0
Pengguna Google,penyakit powercreep gila,1,2025-04-06 13:46:07,0
Pengguna Google,"Overaall bagus, namun ada beberapa kekurangan. Yaitu, saat ada cinematic lore, suara yang dikeluarkan oleh animasinya sember/kresek-kresek. Lalu, berikan fitur chat in-game dengan teman.",5,2025-04-06 13:35:59,1
Pengguna Google,"tolong perbaiki isu tentang hp inflation, mending banyak gimmick nya aja ketimbang hp inflation, hp inflation lebih ngerusak keseimbangan meta, kalo gimmick mah bertahan di waktu konten tersebut dan di bos itu doang, kalo hp inflation kan ngerambat kesemuanya, nanti kroco hpnya 1jt udh biasa kyknya,dn juga gk masalah banget global passive mah sebenarnya cuman jika terus berlanjut global passive apa lagi nanti, bisa ngasih crit?, ngasih shield tanpa bawa shielder di tim comp?, serah lu dah hoyo",1,2025-04-06 13:33:42,5
Pengguna Google,apalh ini powercreep,1,2025-04-06 13:29:29,2
Pengguna Google,game jelek,1,2025-04-06 13:29:28,0
Pengguna Google,"castorice global passive is cringe, you shouldve known this was coming devs.",1,2025-04-06 13:28:14,2
Pengguna Google,njir rating nya down,5,2025-04-06 13:22:37,0
Pengguna Google,tolong developher nya dengerin keluhan player nya,3,2025-04-06 13:18:48,0
Pengguna Google,Masalahin powercreep: meragukan party sendiri,5,2025-04-06 13:16:08,0
Pengguna Google,"dari awal rilis ampe sekarang, powercreep tiap karakternya kerasa bet",1,2025-04-06 13:14:24,1
Pengguna Google,bagus,5,2025-04-06 13:14:23,0
Pengguna Google,malas top up lagi karena penyakit powercreeps gila,1,2025-04-06 13:14:02,2
Pengguna Google,"Powercreep, hp inflation, no skip button. EOS aja dah ni game",1,2025-04-06 13:12:37,0
Pengguna Google,I LOVE GLOBAL PASSIVE,5,2025-04-06 13:09:17,0
Pengguna Google,"Penyakit powecreep gila, fitur minim ga ada fitur bikin anak",1,2025-04-06 13:06:35,0
Pengguna Google,POWER CREEP GA NGOTAK EVENT MULAI SEDIKIT,1,2025-04-06 13:04:43,0
Pengguna Google,HSR DEAD GAME. untung aku sudah pensi dari ini game,1,2025-04-06 13:04:39,1
Pengguna Google,ayo hapus GP tidak guna ðŸ¤£ dengan ada nya GP kedepan nya pasti pilihan gacha terbatas apa lgi klw GP naikin cdm cr atau atk ðŸ˜…. d skip nanggung nga d skip char yg d pengen Lom bsa masuk meta,1,2025-04-06 13:00:01,0
Pengguna Google,"saya menyukai gamenya dikarenakan adanya Powercreep yang sangat besar dan mencengangkan seakan akan akhir dunia sudah dekat, saya salut kepada penciptanya karena menciptakan karakter dengan sangat amat overpower sehingga karakter dahulu tidak berguna dan dijadikan sebagai setandar karakter",5,2025-04-06 12:56:42,0
Pengguna Google,"Semakin sini semakin bosenin, story terlalu bertele-tele, saat dialog animasi/gerakan char kaku/sedikit, percakapan jadi berasa tidak hidup -_- HP Inflation maksa player untuk selalu gacha char baru, tidak diberi kesempatan menabung untuk char yg disuka ðŸ‘Ž Event sedikit & tidak menarik -_- Hadiah konten end game tidak sebanding dengan effort yg harus dikeluarkan ðŸ‘Ž",1,2025-04-06 12:56:04,0
Pengguna Google,game bagus,5,2025-04-06 12:55:38,0
Pengguna Google,game bagus,1,2025-04-06 12:53:09,1
Pengguna Google,game turnbase dengan system power creep yg ndak ngotak!,1,2025-04-06 12:48:30,0
Pengguna Google,"Hei kalian Fandom Tolol aku gatau kalian dateng dari game mana tapi mending gausah caper deh, Game adem ayem gara gara Fandom kek kalian jadi merusak suasana kalo kalian mau gatcha gausah main meta meta,mau kok banyak cocot banyak alasan",5,2025-04-06 12:45:28,2
Pengguna Google,tolong ini powecreepnya di kondisikan yh,1,2025-04-06 12:43:04,0
Pengguna Google,"Bosen liat ceritanya gak ada Kafka, pilihan jawaban Aku mau bisa meluk Kafka dalam quest nya sumpah aku kangen",2,2025-04-06 12:40:24,0
Pengguna Google,"Penyepongnya banyak banget Aku main dari day 1 pun jujur males banget sama powercreep yang bikin susah make karakter fav apalagi ini mau ada global passive (di masa depan nanti banyak char baru yang bawa global passive juga) Bahkan storynya mid + terlalu ngandelin cutscene itupun banyak blackscreen kalo dibandingin sama Hi3 walaupun dari company yang sama (terlalu ngefokus karakter B5 baru, gak ada patch kosong buat story/rerun karakter lama yang lebih mendingan daripada di gas powercreep terus)",1,2025-04-06 12:37:50,0
Pengguna Google,Hp inflation nya kelewatan.,1,2025-04-06 12:33:49,2
Pengguna Google,"game yang sebenarnya bagus jika developer nya tidak terlalu mencari cuan, dengan gimmick global buff, yang secara tidak langsung menyuruh semua player untuk menggacha Chara tersebut agar tidak ketinggalan, itu menurut saya sudah sangat sangat keterlaluan, bukannya mengoptimalkan Chara lama, malah buat gimmick ga guna demi cuan lebih, sehat sehat developer",1,2025-04-06 12:33:07,46
Pengguna Google,keliatan banget kikirnya harus banget ya gacha karakter baru,1,2025-04-06 12:32:21,0
Pengguna Google,"tolonglah sizenya, hp mid range saya sudah tidak kuat, dan juga powerceep nya sangat terasa!!! harap dapat dibenahi.",1,2025-04-06 12:29:53,0
Pengguna Google,game turnbased tapi inflasi HPNYA LUARBIASA. KARAKTER LAMA GA DI BUFF BUFF JUALAN JARAKTER BARU MULU,1,2025-04-06 12:28:37,0
Pengguna Google,Sorry to say GP(Global Passive) mending hilangin aja udahlah char sebelumnya kena powerkrip segi equal to damage eh ini malah ditambahin GP game hewan berkaki empat dasar+relic wellbuild susah dapat iya tau kita bisa racik sendiri tapi itemnya susah dapat so from now on udah gak peduli lagi sama rating relic yang penting relic B5 udah upgrade aja walaupun gak tepat sasaran,1,2025-04-06 12:26:47,0
Pengguna Google,Game pembaik,5,2025-04-06 12:25:34,0
Pengguna Google,Makasih Hoyo aku dapat kafka di pity 25 rate offâ¤â¤â¤â¤,5,2025-04-06 12:21:06,1
Pengguna Google,Game yang cukup seru. story yang terbilang enak diikutin. untuk setiap musuh disetiap planet memang berbeda dan juga membutuhkan charakter khusu dari planet tersebut. tapi bukan berarti charakter lain ngak seimbang. untuk powercreep sendiri memang cukup berasa kalo pandangan Seperti di MOC,5,2025-04-06 12:21:01,374
Pengguna Google,powercreep star rail is real,1,2025-04-06 12:20:12,0
Pengguna Google,power crapp,1,2025-04-06 12:18:14,0
Pengguna Google,"asik banget game nya, design char nya pun cakep cakep, bansos nya juga banyak banget!! suka banget deh sama game nya, recommended juga",5,2025-04-06 12:17:08,0
Pengguna Google,"overall menurut gua game ini bagus buat lu yg suka game tipe turn base, apalagi nih game nyediain efek yg menurut gua bagus dan menyala bnget, desain charnya pun the best parah, btw bansos yg dikasih dari hoyo disini ga dkit, Disni lu kelarin quest bener"" dikasih stellar Jade seimpas bro, quest lama rata"" dapet 100 sj, beda banget ya sama yg itu mau lu kelarin brp jam dapetnya maksimal cuma 40-60",5,2025-04-06 12:15:36,2
Pengguna Google,seru banget,5,2025-04-06 12:13:18,0
Pengguna Google,"Maen pas anniversary pertama gw liatnya kek seru banget ini game,bansos lancar,kondisi endgamenya cukup stabil,eh lama kelamaan malah makin parah ini game, mulai dari powercreep yg ga ngotak,apalagi setelah feixiao rilis hp inflationnya makin parah,story amphoreus milking flamechaser banget,se-tidak kreatif itu kah team story making hsr? sampe tinggal kopas kakaknyaðŸ¤£apalagi black screen bejibun tuh,global passive juga menunjukkan seberapa busuknya ini game,bisa aja hoyo kepikiran gp yg lbh rsak",1,2025-04-06 12:11:27,0
Pengguna Google,"endgame gak ngontak, powercreep character gak ngotak, story panjangnya gak ngotak. ngotak dikit ngapa njir kek Minecraft",1,2025-04-06 12:09:52,0
Pengguna Google,udah mulai kikir,1,2025-04-06 12:08:37,0
Pengguna Google,kecewa sama update terbarunya,1,2025-04-06 12:03:07,0
Pengguna Google,karakter baru ngepower creep karakter lama.,1,2025-04-06 11:53:33,0
Pengguna Google,Power creepnya sih kebangetan,1,2025-04-06 11:52:41,0
Pengguna Google,"1. Powercreep yg udah terlalu parah Char lama bener bener gak bisa di pake lagi kalau gak ada Eidolon atau sign nya Ayo lah hoyo rebalance lagi char nya Harapan sih dengan buff di 3.4 nanti bisa ngasih solusi. 2. Story telling nya udah sedikit improve dari 3.0 kemaren, tapi bisalah di improve lebih jauh lagi, dari segi pengambilan kamera, pergerakan charnya yg kaku dan kurang ekspresif. Sampe saat itu gw kasih 1 star dulu, kalo masalah ini udah bisa di atasi gw bakal balikin ke 5 star lagi",1,2025-04-06 11:52:35,35
Pengguna Google,Jangan pernah pelit ya game baik...,5,2025-04-06 11:47:16,0
Pengguna Google,Asik jirðŸ¤­,5,2025-04-06 11:44:32,0
Pengguna Google,"Overall ini game favourite saya, terutama dari segi story yang bener2 bikin penasaran tiap update, yang bikin males cuma farming relic aja sih soalnya jarang dapet yang bagus. Sama tolong kedepannya tambah karakter B4 lagi masa itu2 aja, kalau bisa mungkin tiap patch 1 atau 2 lah char B4 nya.",5,2025-04-06 11:43:51,0
Pengguna Google,"game powercreep gilak, mana buat selesai in konten end game butuh char yg baru rilis biar maksimal kasih buff nya",1,2025-04-06 11:40:22,0
Pengguna Google,"Kok akun ku tiba tiba kena to many request sih, jadi ga bisa login game, aneh emang ini game",1,2025-04-06 11:39:07,0
Pengguna Google,"dari segi gameplay bagus, ditambah game nya cocok karena tidak membutuhkan banyak waktu untuk bermain",5,2025-04-06 11:38:40,0
Pengguna Google,ttp menyala HSR ! dikala para bocah pea beri rating jelek,5,2025-04-06 11:34:17,0
Pengguna Google,bagus bagus aja ini game cuman saran saya kasi buff karakter lama dan kurangi powercreep nya yaa mihoyo,5,2025-04-06 11:33:10,0
Pengguna Google,Kecewa tidak ada fitur bikin anak ðŸ˜¡,1,2025-04-06 11:33:08,1
Pengguna Google,murah hati,5,2025-04-06 11:30:32,0
Pengguna Google,"Hoyo sialan gua kalah rate off Mulu tiap banner bngst, tapi gak papalah, gua player f2p bisa apa. nih rating 5 karena saya baik hati ðŸ˜¼ðŸ˜¼",5,2025-04-06 11:27:09,0
Pengguna Google,"yuk ganyang sampai bawah , sampai di ganti mihoyo",1,2025-04-06 11:25:34,0
Pengguna Google,sehat sehat game yang fandom nya ribetðŸ˜®â€ðŸ’¨,5,2025-04-06 11:24:22,0
Pengguna Google,"developer budeg di feedback ga denger sama sekali, tidak ada yang suka global passive, kalian sama saja memaksakan gacha karakter walau tak suka demi buff permanen di lingkungan POWERCREEP yang amat sangat parah ditambah dengan inflasi HP dan juga mekanik bos endgame memiliki mekanik yang mengharuskan menggunakan karakter baru. Saya player HSR sejak rilis sangatlah kecewa terhadap perkembangan game ini. Uninstall telah kulakukan, selamat tinggal hsr, it's a been a good run.",1,2025-04-06 11:18:22,1
Pengguna Google,jelek,1,2025-04-06 11:12:39,0
Pengguna Google,gua dapet relic ampas mulu aelahh,1,2025-04-06 11:07:42,0
Pengguna Google,powercreep nya jelek,1,2025-04-06 11:03:55,0
Pengguna Google,game nya seru itu aja,5,2025-04-06 11:01:15,0
Pengguna Google,"fitur end game? , hanya untuk karakter baru ,jika ingin menyelesaikan full star ðŸ’€",2,2025-04-06 10:57:34,0
Pengguna Google,"karakter lama udah gak relevan lagi buat dimainin sekarang, karakter bintang 5 jaman dulu terasa seperti karakter bintang 4",1,2025-04-06 10:55:15,1
Pengguna Google,3.2 ini baru game baik tidak kikir,5,2025-04-06 10:53:03,0
Pengguna Google,1 pull for cas-chan please,5,2025-04-06 10:50:57,0
Pengguna Google,"Salah satu game yg power creepnya terparah, karakter baru rilis = karakter lama gak guna",1,2025-04-06 10:35:39,0
Pengguna Google,"powercreep ga ngotak, global passife lgi cuma buat char cwe, secara ga langsung hoyo maksa pemainnya buat mengeluarkan uang lebih demi bisa dpt tuh char global passife, mas hoyo mas hoyo ðŸ™ƒðŸ™ƒðŸ™ƒ",5,2025-04-06 10:35:08,0
Pengguna Google,"tolong kasih fitur skip di bagian dialognya, karna bermain saya sangat terbatas, setidaknya saya juga mau eksplor krna pemangkas waktu tidak ada & pembagian waktu yg aga susah",5,2025-04-06 10:01:11,2
Pengguna Google,bagus,5,2025-04-06 09:52:35,0
Pengguna Google,Bansos ðŸ¤‘ðŸ¤‘ðŸ¤‘,5,2025-04-06 09:46:00,2
Pengguna Google,"gamenya oke, konten dan eventnya seru ditambah reward yang banyak. Sayangnya, power creepnya gila-gilaan kayak disetiap patch baru dsrh gacha karakter baru, jadi harus ngikuti meta banget supaya bisa ngejar konten endgame, yang ngebuat kita sebagai player gak bisa ngegacha karakter Waifu yang di pengen. Semoga gamenya lebih balance lagi lah dari segi karakter dan konten2nya supaya gak terlalu memberatkan player f2p.",3,2025-04-06 09:38:43,8
Pengguna Google,"yang nyocot gara"" global passive,gk ush dimainin aja gamenya brisik amat jadi orng",5,2025-04-06 09:29:27,2
Pengguna Google,PENYAKIT POWERCREEP GILAA!!!,1,2025-04-06 09:25:23,4
Pengguna Google,Ikut trend orang fomo rating 1 di hsr,5,2025-04-06 09:24:46,0
Pengguna Google,"CRAZY POWERCREEP, DO SOMETHING DAWEI!!!",1,2025-04-06 09:23:05,4
Pengguna Google,Story nya ampas,1,2025-04-06 09:17:03,4
Pengguna Google,tidak ada buff karakter lama,1,2025-04-06 09:07:59,0
Pengguna Google,firefly... the best powercreep i've ever had,1,2025-04-06 08:58:33,2
Pengguna Google,For you,5,2025-04-06 08:54:45,0
Pengguna Google,"Lebay bner dah yg protes global passive castorice, EMG kalian sering nyumbang donasi ke gem ini? Enggak kan ywdh diem ajaðŸ˜‚ðŸ˜‚ðŸ˜‚",4,2025-04-06 08:44:51,0
Pengguna Google,"mantap yah, yang ngeluh global pasif f2p banyak mauðŸ¤®",5,2025-04-06 08:34:34,1
Pengguna Google,"Semangat terus developer, jangan patah semangat!!!",5,2025-04-06 08:31:14,2
Pengguna Google,makin rusak nih game kek genshin,1,2025-04-06 08:16:44,3
Pengguna Google,seru game nya,5,2025-04-06 08:16:05,1
Pengguna Google,game baik,5,2025-04-06 08:08:59,0
Pengguna Google,maksa banget jual karakternya biar laku sampe di HP inflation,1,2025-04-06 08:04:58,2
Pengguna Google,gamenya bagus cuman saat memulai cut sceen sering leg dan ngebug tolong diperbaiki,5,2025-04-06 08:03:15,1
Pengguna Google,"game bagus rek, saya suka gacha (WaifuðŸ˜‹)",5,2025-04-06 08:01:31,1
Pengguna Google,"Dengarkanlah Player, beri apa yang player mau, jangan tamak dan rakus, anniversary ke 2 bukannya menjadi momen player baru bermain malah menjadi momen player lama berhenti. Global passive, HP inflation, dan powercreep, selesaikan 3 masalah ini jangan hanya memberi fitur yang tidak berguna seperti optimalisasi relic namun relic pre set yang dibutuhkan player tidak pernah dibuat sekali lagi dengarkanlah keinginan player jangan menunggu ada game saingan baru atau player pensi",1,2025-04-06 07:48:50,25
Pengguna Google,terlalu menuntut pemain untuk menggacha karakter baru,1,2025-04-06 07:39:06,2
Pengguna Google,"tch, baiki bug ce mu gajelas",1,2025-04-06 07:33:28,1
Pengguna Google,game bagsu sekali saya tidak bermain tapi,1,2025-04-06 07:25:57,1
Pengguna Google,game santai cocok buat waktu senggang,5,2025-04-06 07:24:39,1
